{
  "$schema": "https://json-schema.org/draft/2020-12/schema",
  "$id": "https://yhnocoder.github.io/tongtu/schemas/blocks.schema.json",
  "title": "blocks.json",
  "description": "掩码块清单（mask 阶段产出，架构 §3.1/§7）：每个重环境的类型、label、原始 TeX 与源码位置，外加从块内抽出的可翻译 caption 槽位。unmask 按此文件回填；survey 的选择性回填视图由 category/survey_restore 字段驱动。**掩码无损**是硬约束：掩码流是给 LLM 看的投影（重环境与散文注释都成了 ⟦BLK-n⟧、caption 被单行化摘成 ⟦CAP-k⟧ 行），凡从流里消失的内容都在本文件里留有逐字节原文，故 unmask(mask(x)) == x 逐字节成立。",
  "type": "object",
  "required": ["contract_version", "source", "blocks"],
  "additionalProperties": false,
  "properties": {
    "contract_version": {
      "$ref": "#/$defs/contract_version"
    },
    "source": {
      "type": "object",
      "description": "掩码输入（flat.tex）的溯源信息。",
      "required": ["path"],
      "additionalProperties": false,
      "properties": {
        "path": {
          "type": "string",
          "description": "相对工作目录的路径，通常为 build/flat.tex。"
        },
        "sha256": {
          "$ref": "#/$defs/sha256",
          "description": "输入文件内容 hash，往返自检与增量构建的依据。"
        },
        "chars": {
          "type": "integer",
          "minimum": 0,
          "description": "输入字符数，用于「多少内容进了 LLM」的统计。"
        }
      }
    },
    "blocks": {
      "type": "array",
      "description": "掩码块，按在源码中出现的顺序排列。",
      "items": {
        "$ref": "#/$defs/block"
      }
    },
    "captions": {
      "type": "array",
      "description": "从块内抽出的可翻译文本槽位（caption / captionof / title / abstract）。",
      "items": {
        "$ref": "#/$defs/caption"
      }
    },
    "environments": {
      "type": "array",
      "description": "全文 \\begin{X} 环境名的完备枚举及其分类结论（架构 §3.1 第 2 层）。",
      "items": {
        "type": "object",
        "required": ["name", "classification"],
        "additionalProperties": false,
        "properties": {
          "name": {
            "type": "string",
            "description": "环境名，如 theorem、tabularx。"
          },
          "classification": {
            "enum": ["prose", "heavy"],
            "description": "散文（进翻译流）或重环境（整块掩码）。未知环境按保守默认归入 heavy，其块 category 为 unknown。"
          },
          "decided_by": {
            "enum": ["table", "newtheorem", "newenvironment", "agent", "default"],
            "description": "分类来源：分类表 / \\newtheorem 声明自动归类 / \\newenvironment 声明按其委托的环境归类 / 关节③ agent 判断 / 保守默认。"
          },
          "category": {
            "type": "string",
            "description": "heavy 环境对应的块分类（取值同 block.category）；prose 环境无此字段。"
          },
          "count": {
            "type": "integer",
            "minimum": 0,
            "description": "该环境在全文中出现次数。"
          }
        }
      }
    },
    "roundtrip_ok": {
      "type": "boolean",
      "description": "运行时往返自检结果：unmask(mask(x)) == x。为 false 时流水线不得放行。"
    }
  },
  "$defs": {
    "contract_version": {
      "type": "string",
      "pattern": "^[0-9]+\\.[0-9]+(\\.[0-9]+)?$",
      "description": "产物契约版本号（当前草案 0.1）。契约变更须先改 schema 再 bump 此值。"
    },
    "sha256": {
      "type": "string",
      "pattern": "^[0-9a-f]{64}$",
      "description": "小写十六进制 SHA-256。"
    },
    "span": {
      "type": "object",
      "description": "在掩码输入文件中的源码位置，字符偏移半开区间 [start, end)。",
      "required": ["start", "end"],
      "additionalProperties": false,
      "properties": {
        "start": { "type": "integer", "minimum": 0 },
        "end": { "type": "integer", "minimum": 0 },
        "line_start": { "type": "integer", "minimum": 1, "description": "1-based 起始行号。" },
        "line_end": { "type": "integer", "minimum": 1, "description": "1-based 结束行号。" }
      }
    },
    "block": {
      "type": "object",
      "required": ["id", "placeholder", "category", "tex"],
      "additionalProperties": false,
      "properties": {
        "id": {
          "type": "string",
          "pattern": "^BLK-[0-9]+$",
          "description": "块 id，前导区恒为 BLK-0。"
        },
        "placeholder": {
          "type": "string",
          "description": "掩码流中的不透明占位符，形如 ⟦BLK-3⟧。validate 的占位符 multiset 比对以此为单位。"
        },
        "category": {
          "enum": [
            "preamble",
            "math",
            "table",
            "figure",
            "algorithm",
            "code",
            "tikz",
            "theorem",
            "comment",
            "other",
            "unknown"
          ],
          "description": "块分类，驱动 unmask 的参数化回填与 survey 的选择性回填视图。comment = 散文里被掩掉的注释段（掩码无损的前提，见 tongtu/stages/mask.py 模块文档）；unknown = 分类表与关节③都没给出结论、按保守默认整块掩码的环境，供 report 统计覆盖率。"
        },
        "environment": {
          "type": "string",
          "description": "LaTeX 环境名（如 align*、tabularx）；前导区块无此字段。"
        },
        "label": {
          "type": ["string", "null"],
          "description": "块内 \\label{...} 的值，anchors 合成时的交叉引用键。"
        },
        "tex": {
          "type": "string",
          "description": "原始 TeX 全文（含 \\begin/\\end），caption 已替换为 ⟦CAP-k⟧ 槽位。回填即用此串。带 CAP 行的块会把紧随其后的那个换行一并吸收进来（span 同步 +1），使掩码流里的 CAP 行不额外增加空行——故本串可能以换行结尾。"
        },
        "span": { "$ref": "#/$defs/span" },
        "survey_restore": {
          "type": "boolean",
          "description": "survey 通读视图中是否回填原文（数学类为 true，表格/图/代码为 false）。"
        },
        "caption_ids": {
          "type": "array",
          "items": { "type": "string" },
          "description": "本块内抽出的 caption 槽位 id。"
        }
      }
    },
    "caption": {
      "type": "object",
      "required": ["id", "placeholder", "text", "stream_text"],
      "additionalProperties": false,
      "properties": {
        "id": {
          "type": "string",
          "pattern": "^CAP-[0-9]+$",
          "description": "caption 槽位 id。"
        },
        "placeholder": {
          "type": "string",
          "description": "块内的槽位占位符，形如 ⟦CAP-2⟧。"
        },
        "block_id": {
          "type": "string",
          "description": "所属块 id。"
        },
        "kind": {
          "enum": ["caption", "captionof", "title", "abstract", "other"],
          "description": "槽位来源。"
        },
        "text": {
          "type": "string",
          "description": "槽位**逐字节原文**（含换行与注释）。回填的权威来源，也是往返自检恒等的依据。"
        },
        "stream_text": {
          "type": "string",
          "description": "该槽位在掩码流 ⟦CAP-k⟧ 行里的单行化展示文本（剥注释、折叠空白；abstract 的段落以 \\par 相连）。unmask 据此判定「未改动 ⇒ 回填原文」：流中该行文本与本字段相同或为空即视为未翻译，回填 text 原文，否则当作译文。"
        }
      }
    }
  }
}
