{
 "contract_version": "0.2",
 "source": {
  "path": "tests/data/mask/article_basic.tex",
  "sha256": "37217a89c5c5ac23428436c9b5084db4499b47e1782e80922ef9b5cc4817a318",
  "chars": 1204
 },
 "blocks": [
  {
   "id": "BLK-0",
   "placeholder": "⟦BLK-0⟧",
   "category": "preamble",
   "tex": "\\documentclass[11pt]{article}\n% 前导区里的注释整体属于 BLK-0，不单独成块\n\\usepackage{amsmath}\n\\usepackage{graphicx}\n\\title{⟦CAP-0⟧}\n\\author{A. Nonymous}\n\n\\begin{document}\n",
   "span": {
    "start": 0,
    "end": 195,
    "line_start": 1,
    "line_end": 8
   },
   "survey_restore": false,
   "caption_ids": [
    "CAP-0"
   ]
  },
  {
   "id": "BLK-1",
   "placeholder": "⟦BLK-1⟧",
   "category": "comment",
   "tex": "% 行尾注释：只吞它自己这一段\n%% 连续的整行注释合并成一个块\n%% 免得掩码流被占位符搅碎",
   "span": {
    "start": 341,
    "end": 388,
    "line_start": 14,
    "line_end": 16
   },
   "survey_restore": false,
   "label": null
  },
  {
   "id": "BLK-2",
   "placeholder": "⟦BLK-2⟧",
   "category": "figure",
   "tex": "\\begin{figure}[t]\n  \\centering\n  \\includegraphics[width=0.6\\linewidth]{pipeline.pdf}\n  \\caption[⟦CAP-1⟧]{⟦CAP-2⟧}\n  \\label{fig:pipeline}\n\\end{figure}\n",
   "span": {
    "start": 490,
    "end": 753,
    "line_start": 20,
    "line_end": 26
   },
   "survey_restore": false,
   "environment": "figure",
   "label": "fig:pipeline",
   "caption_ids": [
    "CAP-1",
    "CAP-2"
   ]
  },
  {
   "id": "BLK-3",
   "placeholder": "⟦BLK-3⟧",
   "category": "math",
   "tex": "\\begin{equation}\n  \\label{eq:mask}\n  m(x) = \\sum_{i} b_i\n\\end{equation}",
   "span": {
    "start": 792,
    "end": 863,
    "line_start": 29,
    "line_end": 32
   },
   "survey_restore": true,
   "environment": "equation",
   "label": "eq:mask"
  },
  {
   "id": "BLK-4",
   "placeholder": "⟦BLK-4⟧",
   "category": "table",
   "tex": "\\begin{table}[h]\n  \\centering\n  \\begin{tabular}{lr}\n    stage & cost \\\\\n    mask  & 0    \\\\\n  \\end{tabular}\n  \\caption{⟦CAP-3⟧}\n  \\label{tab:cost}\n\\end{table}\n",
   "span": {
    "start": 1020,
    "end": 1188,
    "line_start": 39,
    "line_end": 47
   },
   "survey_restore": false,
   "environment": "table",
   "label": "tab:cost",
   "caption_ids": [
    "CAP-3"
   ]
  }
 ],
 "captions": [
  {
   "id": "CAP-0",
   "placeholder": "⟦CAP-0⟧",
   "block_id": "BLK-0",
   "kind": "title",
   "text": "Deterministic Pipelines for \\LaTeX{} Translation",
   "stream_text": "Deterministic Pipelines for \\LaTeX{} Translation"
  },
  {
   "id": "CAP-1",
   "placeholder": "⟦CAP-1⟧",
   "block_id": "BLK-2",
   "kind": "caption",
   "text": "Pipeline overview",
   "stream_text": "Pipeline overview"
  },
  {
   "id": "CAP-2",
   "placeholder": "⟦CAP-2⟧",
   "block_id": "BLK-2",
   "kind": "caption",
   "text": "The deterministic pipeline: masking, chunking and\n  the compile loop.  Note the escaped \\% inside the caption.",
   "stream_text": "The deterministic pipeline: masking, chunking and the compile loop. Note the escaped \\% inside the caption."
  },
  {
   "id": "CAP-3",
   "placeholder": "⟦CAP-3⟧",
   "block_id": "BLK-4",
   "kind": "caption",
   "text": "Costs per stage.",
   "stream_text": "Costs per stage."
  }
 ],
 "environments": [
  {
   "name": "document",
   "classification": "prose",
   "decided_by": "table",
   "count": 1
  },
  {
   "name": "equation",
   "classification": "heavy",
   "decided_by": "table",
   "count": 1,
   "category": "math"
  },
  {
   "name": "figure",
   "classification": "heavy",
   "decided_by": "table",
   "count": 1,
   "category": "figure"
  },
  {
   "name": "itemize",
   "classification": "prose",
   "decided_by": "table",
   "count": 1
  },
  {
   "name": "table",
   "classification": "heavy",
   "decided_by": "table",
   "count": 1,
   "category": "table"
  },
  {
   "name": "tabular",
   "classification": "heavy",
   "decided_by": "table",
   "count": 1,
   "category": "table"
  }
 ],
 "roundtrip_ok": true
}
